Bus Hound 6.01 capture on Windows Vista (x64). Complements of www.perisoft.net

  Device - Device ID (followed by the endpoint for USB devices)
            (20) USB Composite Device
            (21) USB Input Device
            (22) USB Input Device
            (46) USB Composite Device
            (47) USB Input Device
            (48) USB Input Device
            (99) USB Composite Device
            (100) USB Input Device
            (101) USB Input Device
            (109) USB Input Device
            (117) USB Composite Device
            (118) USB Input Device
            (119) USB Input Device
            (126) USB Composite Device
            (127) USB Input Device
            (128) USB Input Device
            (149) WB Device in DFU Mode
            (166) Unknown USB Device (Device Descriptor Request Failed)
            (199) USB Composite Device
            (200) USB Input Device
            (201) USB Input Device
            (208) USB Composite Device
            (209) USB Input Device
            (210) USB Input Device
            (217) USB Composite Device
            (218) USB Input Device
            (219) USB Input Device
            (220) USB Input Device
            (221) HID Keyboard Device
            (222) HID-compliant vendor-defined device
            (223) HID-compliant mouse
            (224) HID-compliant consumer control device
            (225) HID-compliant vendor-defined device
            (226) HID Keyboard Device
            (227) HID-compliant vendor-defined device
            (229) USB Input Device
            (230) USB Input Device
            (231) USB Input Device
            (252) USB Mass Storage Device
            (253) ADATA USB Flash Drive [ROM=1100]
            (302) Unknown USB Device (Device Descriptor Request Failed)
            (303) USB Mass Storage Device
            (304) ADATA USB Flash Drive [ROM=1100]
            (305) Unknown USB Device (Port Reset Failed)
            (325) USB Input Device
            (326) USB Input Device
  Length - Total transfer length
  Phase  - Phase Type
            CTL   USB control transfer       
            IN    Data in transfer           
            OUT   Data out transfer          
  Data   - Hex dump of the data transferred
  Descr  - Description of the phase
  Delta  - Elapsed time from the previous phase to the current phase
  Cmd... - Position in the captured data
  Date   - Date the phase occurred in year/month/day form
  Time   - Time the phase occurred in hour:minute:second.millisec form


Device  Length    Phase  Data                                                Description       Delta  Cmd.Phase.Ofs(rep)  Date        Time        
------  --------  -----  --------------------------------------------------  ----------------  -----  ------------------  ----------  ------------
 210.0            CTL    21 09 03 03  01 00 40 00                            SET REPORT        3.6sc         1.1.0        2023/05/31  10:59:13.108  
 210.0        64  OUT    03 03 fb 00  01 01 01 00  00 03 83 01  00 66 01 00  .............f..  1.0ms         1.2.0        2023/05/31  10:59:13.109  
                         00 00 00 00  00 00 00 00  00 00 00 00  00 00 00 00  ................                1.2.16                                 
                         00 00 00 00  00 00 00 00  00 00 00 00  00 00 00 00  ................                1.2.32                                 
                         00 00 00 00  00 00 00 00  00 00 00 00  00 00 00 00  ................                1.2.48                                 
 210.0            CTL    21 09 03 03  01 00 40 00                            SET REPORT        152ms         2.1.0        2023/05/31  10:59:13.262  
 210.0        64  OUT    03 03 fb 01  01 88 00 00  00 01 05 00  00 02 00 4a  ...............J  1.2ms         2.2.0        2023/05/31  10:59:13.263  
                         00 00 00 00  00 00 00 00  00 00 00 00  00 00 00 00  ................                2.2.16                                 
                         00 00 00 00  00 00 00 00  00 00 00 00  00 00 00 00  ................                2.2.32                                 
                         00 00 00 00  00 00 00 00  00 00 00 00  00 00 00 00  ................                2.2.48                                 
 210.0            CTL    21 09 03 03  01 00 40 00                            SET REPORT        156ms         3.1.0        2023/05/31  10:59:13.419  
 210.0        64  OUT    03 03 fb 02  01 66 05 08  00 66 02 00  00 66 01 00  .....f...f...f..  1.0ms         3.2.0        2023/05/31  10:59:13.420  
                         00 00 00 00  00 00 00 00  00 00 00 00  00 00 00 00  ................                3.2.16                                 
                         00 00 00 00  00 00 00 00  00 00 00 00  00 00 00 00  ................                3.2.32                                 
                         00 00 00 00  00 00 00 00  00 00 00 00  00 00 00 00  ................                3.2.48                                 
 210.0            CTL    21 09 03 03  01 00 40 00                            SET REPORT        153ms         4.1.0        2023/05/31  10:59:13.574  
 210.0        64  OUT    03 03 fb 03  01 00 00 00  00 03 8a 01  00 00 00 00  ................  1.2ms         4.2.0        2023/05/31  10:59:13.575  
                         00 00 00 00  00 00 00 00  00 00 00 00  00 00 00 00  ................                4.2.16                                 
                         00 00 00 00  00 00 00 00  00 00 00 00  00 00 00 00  ................                4.2.32                                 
                         00 00 00 00  00 00 00 00  00 00 00 00  00 00 00 00  ................                4.2.48                                 
 210.0            CTL    21 09 03 03  01 00 40 00                            SET REPORT        152ms         5.1.0        2023/05/31  10:59:13.729  
 210.0        64  OUT    03 03 fb 04  01 88 00 00  00 00 00 00  00 00 00 00  ................  981us         5.2.0        2023/05/31  10:59:13.730  
                         00 00 00 00  00 00 00 00  00 00 00 00  00 00 00 00  ................                5.2.16                                 
                         00 00 00 00  00 00 00 00  00 00 00 00  00 00 00 00  ................                5.2.32                                 
                         00 00 00 00  00 00 00 00  00 00 00 00  00 00 00 00  ................                5.2.48                                 
 210.0            CTL    21 09 03 03  01 00 40 00                            SET REPORT        155ms         6.1.0        2023/05/31  10:59:13.885  
 210.0        64  OUT    03 03 fb 05  01 00 00 00  00 00 00 00  00 00 00 00  ................  1.0ms         6.2.0        2023/05/31  10:59:13.886  
                         00 00 00 00  00 00 00 00  00 00 00 00  00 00 00 00  ................                6.2.16                                 
                         00 00 00 00  00 00 00 00  00 00 00 00  00 00 00 00  ................                6.2.32                                 
                         00 00 00 00  00 00 00 00  00 00 00 00  00 00 00 00  ................                6.2.48                                 
 210.0            CTL    21 09 03 03  01 00 40 00                            SET REPORT        154ms         7.1.0        2023/05/31  10:59:14.041  
 210.0        64  OUT    03 05 fb 1c  00 01 01 00  00 00 00 00  00 00 00 00  ................  1.1ms         7.2.0        2023/05/31  10:59:14.043  
                         00 00 00 00  00 00 00 00  00 00 00 00  00 00 00 00  ................                7.2.16                                 
                         00 00 00 00  00 00 00 00  00 00 00 00  00 00 00 00  ................                7.2.32                                 
                         00 00 00 00  00 00 00 00  00 00 00 00  00 00 00 00  ................                7.2.48                                 
 210.0            CTL    21 09 03 03  01 00 40 00                            SET REPORT        258ms         8.1.0        2023/05/31  10:59:14.301  
 210.0        64  OUT    03 05 fb 1b  00 01 01 00  00 00 00 00  00 00 00 00  ................  1.0ms         8.2.0        2023/05/31  10:59:14.302  
                         00 00 00 00  00 00 00 00  00 00 00 00  00 00 00 00  ................                8.2.16                                 
                         00 00 00 00  00 00 00 00  00 00 00 00  00 00 00 00  ................                8.2.32                                 
                         00 00 00 00  00 00 00 00  00 00 00 00  00 00 00 00  ................                8.2.48                                 
 210.0            CTL    21 09 03 03  01 00 40 00                            SET REPORT        236ms         9.1.0        2023/05/31  10:59:14.538  
 210.0        64  OUT    03 05 fb 19  00 01 01 00  00 00 00 00  00 00 00 00  ................  1.1ms         9.2.0        2023/05/31  10:59:14.539  
                         00 00 00 00  00 00 00 00  00 00 00 00  00 00 00 00  ................                9.2.16                                 
                         00 00 00 00  00 00 00 00  00 00 00 00  00 00 00 00  ................                9.2.32                                 
                         00 00 00 00  00 00 00 00  00 00 00 00  00 00 00 00  ................                9.2.48                                 
 210.0            CTL    21 09 03 03  01 00 40 00                            SET REPORT        261ms        10.1.0        2023/05/31  10:59:14.801  
 210.0        64  OUT    03 05 fb 1d  00 01 01 00  00 00 00 00  00 00 00 00  ................  1.1ms        10.2.0        2023/05/31  10:59:14.802  
                         00 00 00 00  00 00 00 00  00 00 00 00  00 00 00 00  ................               10.2.16                                 
                         00 00 00 00  00 00 00 00  00 00 00 00  00 00 00 00  ................               10.2.32                                 
                         00 00 00 00  00 00 00 00  00 00 00 00  00 00 00 00  ................               10.2.48                                 
 210.0            CTL    21 09 03 03  01 00 40 00                            SET REPORT        236ms        11.1.0        2023/05/31  10:59:15.038  
 210.0        64  OUT    03 05 fb 1a  00 01 01 00  00 00 00 00  00 00 00 00  ................  1.1ms        11.2.0        2023/05/31  10:59:15.040  
                         00 00 00 00  00 00 00 00  00 00 00 00  00 00 00 00  ................               11.2.16                                 
                         00 00 00 00  00 00 00 00  00 00 00 00  00 00 00 00  ................               11.2.32                                 
                         00 00 00 00  00 00 00 00  00 00 00 00  00 00 00 00  ................               11.2.48                                 
 210.0            CTL    21 09 03 03  01 00 40 00                            SET REPORT        8.1sc        12.1.0        2023/05/31  10:59:23.227  
 210.0        64  OUT    03 03 fb 00  01 01 01 00  00 01 02 00  00 01 03 00  ................  1.2ms        12.2.0        2023/05/31  10:59:23.229  
                         00 00 00 00  00 00 00 00  00 00 00 00  00 00 00 00  ................               12.2.16                                 
                         00 00 00 00  00 00 00 00  00 00 00 00  00 00 00 00  ................               12.2.32                                 
                         00 00 00 00  00 00 00 00  00 00 00 00  00 00 00 00  ................               12.2.48                                 
 210.0            CTL    21 09 03 03  01 00 40 00                            SET REPORT        162ms        13.1.0        2023/05/31  10:59:23.391  
 210.0        64  OUT    03 03 fb 01  01 01 04 00  00 01 05 00  00 02 00 4a  ...............J  1.3ms        13.2.0        2023/05/31  10:59:23.393  
                         00 00 00 00  00 00 00 00  00 00 00 00  00 00 00 00  ................               13.2.16                                 
                         00 00 00 00  00 00 00 00  00 00 00 00  00 00 00 00  ................               13.2.32                                 
                         00 00 00 00  00 00 00 00  00 00 00 00  00 00 00 00  ................               13.2.48                                 
 210.0            CTL    21 09 03 03  01 00 40 00                            SET REPORT        154ms        14.1.0        2023/05/31  10:59:23.547  
 210.0        64  OUT    03 03 fb 02  01 66 05 08  00 66 02 00  00 66 01 00  .....f...f...f..  1.1ms        14.2.0        2023/05/31  10:59:23.548  
                         00 00 00 00  00 00 00 00  00 00 00 00  00 00 00 00  ................               14.2.16                                 
                         00 00 00 00  00 00 00 00  00 00 00 00  00 00 00 00  ................               14.2.32                                 
                         00 00 00 00  00 00 00 00  00 00 00 00  00 00 00 00  ................               14.2.48                                 
 210.0            CTL    21 09 03 03  01 00 40 00                            SET REPORT        153ms        15.1.0        2023/05/31  10:59:23.702  
 210.0        64  OUT    03 03 fb 03  01 00 00 00  00 00 00 00  00 00 00 00  ................  1.2ms        15.2.0        2023/05/31  10:59:23.703  
                         00 00 00 00  00 00 00 00  00 00 00 00  00 00 00 00  ................               15.2.16                                 
                         00 00 00 00  00 00 00 00  00 00 00 00  00 00 00 00  ................               15.2.32                                 
                         00 00 00 00  00 00 00 00  00 00 00 00  00 00 00 00  ................               15.2.48                                 
 210.0            CTL    21 09 03 03  01 00 40 00                            SET REPORT        157ms        16.1.0        2023/05/31  10:59:23.861  
 210.0        64  OUT    03 03 fb 04  01 00 00 00  00 00 00 00  00 00 00 00  ................  1.1ms        16.2.0        2023/05/31  10:59:23.862  
                         00 00 00 00  00 00 00 00  00 00 00 00  00 00 00 00  ................               16.2.16                                 
                         00 00 00 00  00 00 00 00  00 00 00 00  00 00 00 00  ................               16.2.32                                 
                         00 00 00 00  00 00 00 00  00 00 00 00  00 00 00 00  ................               16.2.48                                 
 210.0            CTL    21 09 03 03  01 00 40 00                            SET REPORT        151ms        17.1.0        2023/05/31  10:59:24.013  
 210.0        64  OUT    03 03 fb 05  01 00 00 00  00 00 00 00  00 00 00 00  ................  1.0ms        17.2.0        2023/05/31  10:59:24.014  
                         00 00 00 00  00 00 00 00  00 00 00 00  00 00 00 00  ................               17.2.16                                 
                         00 00 00 00  00 00 00 00  00 00 00 00  00 00 00 00  ................               17.2.32                                 
                         00 00 00 00  00 00 00 00  00 00 00 00  00 00 00 00  ................               17.2.48                                 
 210.0            CTL    21 09 03 03  01 00 40 00                            SET REPORT        155ms        18.1.0        2023/05/31  10:59:24.170  
 210.0        64  OUT    03 05 fb 1c  00 01 01 00  00 00 00 00  00 00 00 00  ................  1.0ms        18.2.0        2023/05/31  10:59:24.171  
                         00 00 00 00  00 00 00 00  00 00 00 00  00 00 00 00  ................               18.2.16                                 
                         00 00 00 00  00 00 00 00  00 00 00 00  00 00 00 00  ................               18.2.32                                 
                         00 00 00 00  00 00 00 00  00 00 00 00  00 00 00 00  ................               18.2.48                                 
 210.0            CTL    21 09 03 03  01 00 40 00                            SET REPORT        246ms        19.1.0        2023/05/31  10:59:24.417  
 210.0        64  OUT    03 05 fb 1b  00 01 01 00  00 00 00 00  00 00 00 00  ................  1.0ms        19.2.0        2023/05/31  10:59:24.418  
                         00 00 00 00  00 00 00 00  00 00 00 00  00 00 00 00  ................               19.2.16                                 
                         00 00 00 00  00 00 00 00  00 00 00 00  00 00 00 00  ................               19.2.32                                 
                         00 00 00 00  00 00 00 00  00 00 00 00  00 00 00 00  ................               19.2.48                                 
 210.0            CTL    21 09 03 03  01 00 40 00                            SET REPORT        248ms        20.1.0        2023/05/31  10:59:24.667  
 210.0        64  OUT    03 05 fb 19  00 01 01 00  00 00 00 00  00 00 00 00  ................  981us        20.2.0        2023/05/31  10:59:24.668  
                         00 00 00 00  00 00 00 00  00 00 00 00  00 00 00 00  ................               20.2.16                                 
                         00 00 00 00  00 00 00 00  00 00 00 00  00 00 00 00  ................               20.2.32                                 
                         00 00 00 00  00 00 00 00  00 00 00 00  00 00 00 00  ................               20.2.48                                 
 210.0            CTL    21 09 03 03  01 00 40 00                            SET REPORT        232ms        21.1.0        2023/05/31  10:59:24.900  
 210.0        64  OUT    03 05 fb 1d  00 01 01 00  00 00 00 00  00 00 00 00  ................  1.3ms        21.2.0        2023/05/31  10:59:24.902  
                         00 00 00 00  00 00 00 00  00 00 00 00  00 00 00 00  ................               21.2.16                                 
                         00 00 00 00  00 00 00 00  00 00 00 00  00 00 00 00  ................               21.2.32                                 
                         00 00 00 00  00 00 00 00  00 00 00 00  00 00 00 00  ................               21.2.48                                 
 210.0            CTL    21 09 03 03  01 00 40 00                            SET REPORT        231ms        22.1.0        2023/05/31  10:59:25.134  
 210.0        64  OUT    03 05 fb 1a  00 01 01 00  00 00 00 00  00 00 00 00  ................  1.2ms        22.2.0        2023/05/31  10:59:25.135  
                         00 00 00 00  00 00 00 00  00 00 00 00  00 00 00 00  ................               22.2.16                                 
                         00 00 00 00  00 00 00 00  00 00 00 00  00 00 00 00  ................               22.2.32                                 
                         00 00 00 00  00 00 00 00  00 00 00 00  00 00 00 00  ................               22.2.48                                 
 210.0            CTL    21 09 03 03  01 00 40 00                            SET REPORT        3.7sc        23.1.0        2023/05/31  10:59:28.871  
 210.0        64  OUT    03 02 fb 00  01 01 0c 0c  00 0c 0c 00  00 00 00 00  ................  967us        23.2.0        2023/05/31  10:59:28.872  
                         00 00 00 00  00 00 00 00  00 00 00 00  00 00 00 00  ................               23.2.16                                 
                         00 00 00 00  00 00 00 00  00 00 00 00  00 00 00 00  ................               23.2.32                                 
                         00 00 00 00  00 00 00 00  00 00 00 00  00 00 00 00  ................               23.2.48                                 
 210.0            CTL    21 09 03 03  01 00 40 00                            SET REPORT        282ms        24.1.0        2023/05/31  10:59:29.154  
 210.0        64  OUT    03 02 fb 01  01 01 00 00  00 00 00 00  00 00 00 00  ................  1.1ms        24.2.0        2023/05/31  10:59:29.155  
                         00 00 00 00  00 00 00 00  00 00 00 00  00 00 00 00  ................               24.2.16                                 
                         00 00 00 00  00 00 00 00  00 00 00 00  00 00 00 00  ................               24.2.32                                 
                         00 00 00 00  00 00 00 00  00 00 00 00  00 00 00 00  ................               24.2.48                                 
 210.0            CTL    21 09 03 03  01 00 40 00                            SET REPORT        294ms        25.1.0        2023/05/31  10:59:29.450  
 210.0        64  OUT    03 02 fb 02  01 01 00 00  00 00 00 00  00 00 00 00  ................  999us        25.2.0        2023/05/31  10:59:29.451  
                         00 00 00 00  00 00 00 00  00 00 00 00  00 00 00 00  ................               25.2.16                                 
                         00 00 00 00  00 00 00 00  00 00 00 00  00 00 00 00  ................               25.2.32                                 
                         00 00 00 00  00 00 00 00  00 00 00 00  00 00 00 00  ................               25.2.48                                 
 210.2         8  IN     06 fb 51 00  00 00 00 00                            ..Q.....          9.6sc        26.1.0        2023/05/31  10:59:39.088  
 210.0            CTL    21 09 03 03  01 00 40 00                            SET REPORT        2.3sc        27.1.0        2023/05/31  10:59:41.474  
 210.0        64  OUT    03 03 fb 00  01 01 01 00  00 03 83 01  00 66 01 00  .............f..  1.3ms        27.2.0        2023/05/31  10:59:41.476  
                         00 00 00 00  00 00 00 00  00 00 00 00  00 00 00 00  ................               27.2.16                                 
                         00 00 00 00  00 00 00 00  00 00 00 00  00 00 00 00  ................               27.2.32                                 
                         00 00 00 00  00 00 00 00  00 00 00 00  00 00 00 00  ................               27.2.48                                 
 210.0            CTL    21 09 03 03  01 00 40 00                            SET REPORT        159ms        28.1.0        2023/05/31  10:59:41.635  
 210.0        64  OUT    03 03 fb 01  01 88 00 00  00 01 05 00  00 02 00 4a  ...............J  1.4ms        28.2.0        2023/05/31  10:59:41.637  
                         00 00 00 00  00 00 00 00  00 00 00 00  00 00 00 00  ................               28.2.16                                 
                         00 00 00 00  00 00 00 00  00 00 00 00  00 00 00 00  ................               28.2.32                                 
                         00 00 00 00  00 00 00 00  00 00 00 00  00 00 00 00  ................               28.2.48                                 
 210.0            CTL    21 09 03 03  01 00 40 00                            SET REPORT        153ms        29.1.0        2023/05/31  10:59:41.790  
 210.0        64  OUT    03 03 fb 02  01 66 05 08  00 66 02 00  00 66 01 00  .....f...f...f..  1.3ms        29.2.0        2023/05/31  10:59:41.792  
                         00 00 00 00  00 00 00 00  00 00 00 00  00 00 00 00  ................               29.2.16                                 
                         00 00 00 00  00 00 00 00  00 00 00 00  00 00 00 00  ................               29.2.32                                 
                         00 00 00 00  00 00 00 00  00 00 00 00  00 00 00 00  ................               29.2.48                                 
 210.0            CTL    21 09 03 03  01 00 40 00                            SET REPORT        155ms        30.1.0        2023/05/31  10:59:41.947  
 210.0        64  OUT    03 03 fb 03  01 00 00 00  00 03 8a 01  00 00 00 00  ................  1.0ms        30.2.0        2023/05/31  10:59:41.948  
                         00 00 00 00  00 00 00 00  00 00 00 00  00 00 00 00  ................               30.2.16                                 
                         00 00 00 00  00 00 00 00  00 00 00 00  00 00 00 00  ................               30.2.32                                 
                         00 00 00 00  00 00 00 00  00 00 00 00  00 00 00 00  ................               30.2.48                                 
 210.0            CTL    21 09 03 03  01 00 40 00                            SET REPORT        156ms        31.1.0        2023/05/31  10:59:42.104  
 210.0        64  OUT    03 03 fb 04  01 88 00 00  00 00 00 00  00 00 00 00  ................  1.0ms        31.2.0        2023/05/31  10:59:42.105  
                         00 00 00 00  00 00 00 00  00 00 00 00  00 00 00 00  ................               31.2.16                                 
                         00 00 00 00  00 00 00 00  00 00 00 00  00 00 00 00  ................               31.2.32                                 
                         00 00 00 00  00 00 00 00  00 00 00 00  00 00 00 00  ................               31.2.48                                 
 210.0            CTL    21 09 03 03  01 00 40 00                            SET REPORT        155ms        32.1.0        2023/05/31  10:59:42.260  
 210.0        64  OUT    03 03 fb 05  01 00 00 00  00 00 00 00  00 00 00 00  ................  1.0ms        32.2.0        2023/05/31  10:59:42.261  
                         00 00 00 00  00 00 00 00  00 00 00 00  00 00 00 00  ................               32.2.16                                 
                         00 00 00 00  00 00 00 00  00 00 00 00  00 00 00 00  ................               32.2.32                                 
                         00 00 00 00  00 00 00 00  00 00 00 00  00 00 00 00  ................               32.2.48                                 
 210.0            CTL    21 09 03 03  01 00 40 00                            SET REPORT        154ms        33.1.0        2023/05/31  10:59:42.416  
 210.0        64  OUT    03 02 fb 00  01 06 0c 14  00 0c 14 00  00 00 00 00  ................  1.1ms        33.2.0        2023/05/31  10:59:42.417  
                         00 00 00 00  00 00 00 00  00 00 00 00  00 00 00 00  ................               33.2.16                                 
                         00 00 00 00  00 00 00 00  00 00 00 00  00 00 00 00  ................               33.2.32                                 
                         00 00 00 00  00 00 00 00  00 00 00 00  00 00 00 00  ................               33.2.48                                 
 210.0            CTL    21 09 03 03  01 00 40 00                            SET REPORT        291ms        34.1.0        2023/05/31  10:59:42.708  
 210.0        64  OUT    03 02 fb 01  01 06 00 00  00 00 00 00  00 00 00 00  ................  1.0ms        34.2.0        2023/05/31  10:59:42.709  
                         00 00 00 00  00 00 00 00  00 00 00 00  00 00 00 00  ................               34.2.16                                 
                         00 00 00 00  00 00 00 00  00 00 00 00  00 00 00 00  ................               34.2.32                                 
                         00 00 00 00  00 00 00 00  00 00 00 00  00 00 00 00  ................               34.2.48                                 
 210.0            CTL    21 09 03 03  01 00 40 00                            SET REPORT        298ms        35.1.0        2023/05/31  10:59:43.008  
 210.0        64  OUT    03 02 fb 02  01 06 00 00  00 00 00 00  00 00 00 00  ................  1.2ms        35.2.0        2023/05/31  10:59:43.009  
                         00 00 00 00  00 00 00 00  00 00 00 00  00 00 00 00  ................               35.2.16                                 
                         00 00 00 00  00 00 00 00  00 00 00 00  00 00 00 00  ................               35.2.32                                 
                         00 00 00 00  00 00 00 00  00 00 00 00  00 00 00 00  ................               35.2.48                                 
 210.0            CTL    21 09 03 03  01 00 40 00                            SET REPORT        811ms        36.1.0        2023/05/31  10:59:43.820  
 210.0        64  OUT    03 04 fb 00  01 02 04 01  0a 04 00 08  00 ff ff 00  ................  1.3ms        36.2.0        2023/05/31  10:59:43.822  
                         00 00 00 00  00 00 00 00  00 00 00 00  00 00 00 00  ................               36.2.16                                 
                         00 00 00 00  00 00 00 00  00 00 00 00  00 00 00 00  ................               36.2.32                                 
                         00 00 00 00  00 00 00 00  00 00 00 00  00 00 00 00  ................               36.2.48                                 
 210.0            CTL    21 09 03 03  01 00 40 00                            SET REPORT        167ms        37.1.0        2023/05/31  10:59:43.989  
 210.0        64  OUT    03 04 fb 01  01 10 00 00  00 ff 20 00  ff 00 00 00  .......... .....  1.2ms        37.2.0        2023/05/31  10:59:43.991  
                         00 00 00 00  00 00 00 00  00 00 00 00  00 00 00 00  ................               37.2.16                                 
                         00 00 00 00  00 00 00 00  00 00 00 00  00 00 00 00  ................               37.2.32                                 
                         00 00 00 00  00 00 00 00  00 00 00 00  00 00 00 00  ................               37.2.48                                 
 210.0            CTL    21 09 03 03  01 00 40 00                            SET REPORT        151ms        38.1.0        2023/05/31  10:59:44.142  
 210.0        64  OUT    03 04 fb 02  01 40 00 00  ff 00 00 00  00 00 00 00  .....@..........  1.0ms        38.2.0        2023/05/31  10:59:44.144  
                         00 00 00 00  00 00 00 00  00 00 00 00  00 00 00 00  ................               38.2.16                                 
                         00 00 00 00  00 00 00 00  00 00 00 00  00 00 00 00  ................               38.2.32                                 
                         00 00 00 00  00 00 00 00  00 00 00 00  00 00 00 00  ................               38.2.48                                 
 210.0            CTL    21 09 03 03  01 00 40 00                            SET REPORT        151ms        39.1.0        2023/05/31  10:59:44.296  
 210.0        64  OUT    03 04 fb 03  01 00 00 00  00 00 00 00  00 00 00 00  ................  1.0ms        39.2.0        2023/05/31  10:59:44.298  
                         00 00 00 00  00 00 00 00  00 00 00 00  00 00 00 00  ................               39.2.16                                 
                         00 00 00 00  00 00 00 00  00 00 00 00  00 00 00 00  ................               39.2.32                                 
                         00 00 00 00  00 00 00 00  00 00 00 00  00 00 00 00  ................               39.2.48                                 
 210.0            CTL    21 09 03 03  01 00 40 00                            SET REPORT        159ms        40.1.0        2023/05/31  10:59:44.457  
 210.0        64  OUT    03 05 fb 1c  00 01 01 00  00 00 00 00  00 00 00 00  ................  1.1ms        40.2.0        2023/05/31  10:59:44.458  
                         00 00 00 00  00 00 00 00  00 00 00 00  00 00 00 00  ................               40.2.16                                 
                         00 00 00 00  00 00 00 00  00 00 00 00  00 00 00 00  ................               40.2.32                                 
                         00 00 00 00  00 00 00 00  00 00 00 00  00 00 00 00  ................               40.2.48                                 
 210.0            CTL    21 09 03 03  01 00 40 00                            SET REPORT        265ms        41.1.0        2023/05/31  10:59:44.723  
 210.0        64  OUT    03 05 fb 1b  00 01 01 00  00 00 00 00  00 00 00 00  ................  1.2ms        41.2.0        2023/05/31  10:59:44.724  
                         00 00 00 00  00 00 00 00  00 00 00 00  00 00 00 00  ................               41.2.16                                 
                         00 00 00 00  00 00 00 00  00 00 00 00  00 00 00 00  ................               41.2.32                                 
                         00 00 00 00  00 00 00 00  00 00 00 00  00 00 00 00  ................               41.2.48                                 
 210.0            CTL    21 09 03 03  01 00 40 00                            SET REPORT        238ms        42.1.0        2023/05/31  10:59:44.963  
 210.0        64  OUT    03 05 fb 19  00 01 01 00  00 00 00 00  00 00 00 00  ................  1.4ms        42.2.0        2023/05/31  10:59:44.964  
                         00 00 00 00  00 00 00 00  00 00 00 00  00 00 00 00  ................               42.2.16                                 
                         00 00 00 00  00 00 00 00  00 00 00 00  00 00 00 00  ................               42.2.32                                 
                         00 00 00 00  00 00 00 00  00 00 00 00  00 00 00 00  ................               42.2.48                                 
 210.0            CTL    21 09 03 03  01 00 40 00                            SET REPORT        248ms        43.1.0        2023/05/31  10:59:45.213  
 210.0        64  OUT    03 05 fb 1d  00 01 01 00  00 00 00 00  00 00 00 00  ................  1.1ms        43.2.0        2023/05/31  10:59:45.214  
                         00 00 00 00  00 00 00 00  00 00 00 00  00 00 00 00  ................               43.2.16                                 
                         00 00 00 00  00 00 00 00  00 00 00 00  00 00 00 00  ................               43.2.32                                 
                         00 00 00 00  00 00 00 00  00 00 00 00  00 00 00 00  ................               43.2.48                                 
 210.0            CTL    21 09 03 03  01 00 40 00                            SET REPORT        246ms        44.1.0        2023/05/31  10:59:45.459  
 210.0        64  OUT    03 05 fb 1a  00 01 01 00  00 00 00 00  00 00 00 00  ................  1.0ms        44.2.0        2023/05/31  10:59:45.462  
                         00 00 00 00  00 00 00 00  00 00 00 00  00 00 00 00  ................               44.2.16                                 
                         00 00 00 00  00 00 00 00  00 00 00 00  00 00 00 00  ................               44.2.32                                 
                         00 00 00 00  00 00 00 00  00 00 00 00  00 00 00 00  ................               44.2.48                                 
 210.2        12  IN     01 00 00 00  ff ff 00 03  00 00 00 00               ............      1.7sc        45.1.0        2023/05/31  10:59:47.179  
 210.2        12  IN     01 00 00 00  ff ff 00 03  00 00 00 00               ............      7.0ms        46.1.0        2023/05/31  10:59:47.197  
 210.2        12  IN     01 00 00 00  ff ff 00 03  00 00 00 00               ............      3.9ms        47.1.0        2023/05/31  10:59:47.201  
 210.2        12  IN     01 00 01 00  00 00 00 03  00 00 00 00               ............      3.0ms        48.1.0        2023/05/31  10:59:47.204  
 210.2        12  IN     01 00 00 00  ff ff 00 03  00 00 00 00               ............      1.9ms        49.1.0        2023/05/31  10:59:47.206  
 210.2        12  IN     01 00 00 00  ff ff 00 03  00 00 00 00               ............      2.8ms        50.1.0        2023/05/31  10:59:47.209  
 210.2        12  IN     01 00 01 00  00 00 00 03  00 00 00 00               ............      3.0ms        51.1.0        2023/05/31  10:59:47.212  
 210.2        12  IN     01 00 00 00  ff ff 00 03  00 00 00 00               ............      1.0ms        52.1.0        2023/05/31  10:59:47.213  
 210.2        12  IN     01 00 00 00  ff ff 00 03  00 00 00 00               ............      3.0ms        53.1.0        2023/05/31  10:59:47.217  
 210.2        12  IN     01 00 01 00  00 00 00 03  00 00 00 00               ............      994us        54.1.0        2023/05/31  10:59:47.218  
 210.2        12  IN     01 00 00 00  ff ff 00 03  00 00 00 00               ............      6.0ms        55.1.0        2023/05/31  10:59:47.224  
 210.2        12  IN     01 00 00 00  ff ff 00 03  00 00 00 00               ............      2.0ms        56.1.0        2023/05/31  10:59:47.226  
 210.2        12  IN     01 00 01 00  00 00 00 03  00 00 00 00               ............      1.9ms        57.1.0        2023/05/31  10:59:47.228  
 210.2        12  IN     01 00 00 00  ff ff 00 03  00 00 00 00               ............      6.0ms        58.1.0        2023/05/31  10:59:47.234  
 210.2        12  IN     01 00 01 00  00 00 00 03  00 00 00 00               ............      3.9ms        59.1.0        2023/05/31  10:59:47.238  
 210.2        12  IN     01 00 00 00  ff ff 00 03  00 00 00 00               ............       59ms        60.1.0        2023/05/31  10:59:47.295  
 210.2        12  IN     01 00 01 00  00 00 00 03  00 00 00 00               ............       13ms        61.1.0        2023/05/31  10:59:47.311  
 210.2        12  IN     01 00 00 00  ff ff 00 03  00 00 00 00               ............      2.0ms        62.1.0        2023/05/31  10:59:47.313  
 210.2        12  IN     01 00 00 00  ff ff 00 03  00 00 00 00               ............       24ms        63.1.0        2023/05/31  10:59:47.337  
 210.2        12  IN     01 08 00 00  00 00 00 03  00 00 00 00               ............      100ms        64.1.0        2023/05/31  10:59:47.437  
 210.2        12  IN     01 08 00 00  00 00 00 03  00 00 00 00               ............      4.9ms        65.1.0        2023/05/31  10:59:47.440  
 210.2        12  IN     01 08 00 00  00 00 00 03  00 00 00 00               ............      6.0ms        66.1.0        2023/05/31  10:59:47.440  
 210.2        12  IN     01 08 00 00  00 00 00 03  00 00 00 00               ............      7.0ms        67.1.0        2023/05/31  10:59:47.455  
 210.2        12  IN     01 08 00 00  00 00 00 03  00 00 00 00               ............      5.9ms        68.1.0        2023/05/31  10:59:47.455  
 210.2        12  IN     01 08 00 00  00 00 00 03  00 00 00 00               ............      8.1ms        69.1.0        2023/05/31  10:59:47.455  
 210.2        12  IN     01 08 00 00  00 00 00 03  00 00 00 00               ............      6.9ms        70.1.0        2023/05/31  10:59:47.470  
 210.2        12  IN     01 08 00 00  00 00 00 03  00 00 00 00               ............      5.0ms        71.1.0        2023/05/31  10:59:47.470  
 210.2        12  IN     01 08 00 00  00 00 00 03  00 00 00 00               ............      5.9ms        72.1.0        2023/05/31  10:59:47.485  
 210.2        12  IN     01 08 00 00  00 00 00 03  00 00 00 00               ............      8.0ms        73.1.0        2023/05/31  10:59:47.485  
 210.2        12  IN     01 08 00 00  00 00 00 03  00 00 00 00               ............      6.9ms        74.1.0        2023/05/31  10:59:47.500  
 210.2        12  IN     01 08 00 00  00 00 00 03  00 00 00 00               ............      4.9ms        75.1.0        2023/05/31  10:59:47.507  
 210.2        12  IN     01 08 00 00  00 00 00 03  00 00 00 00               ............      5.9ms        76.1.0        2023/05/31  10:59:47.513  
 210.2        12  IN     01 08 00 00  00 00 00 03  00 00 00 00               ............      8.0ms        77.1.0        2023/05/31  10:59:47.521  
 210.2        12  IN     01 08 00 00  00 00 00 03  00 00 00 00               ............      6.0ms        78.1.0        2023/05/31  10:59:47.528  
 210.2        12  IN     01 08 00 00  00 00 00 03  00 00 00 00               ............      5.9ms        79.1.0        2023/05/31  10:59:47.533  
 210.2        12  IN     01 08 00 00  00 00 00 03  00 00 00 00               ............      6.0ms        80.1.0        2023/05/31  10:59:47.539  
 210.2        12  IN     01 08 00 00  00 00 00 03  00 00 00 00               ............      8.0ms        81.1.0        2023/05/31  10:59:47.548  
 210.2        12  IN     01 08 00 00  00 00 00 03  00 00 00 00               ............      7.9ms        82.1.0        2023/05/31  10:59:47.556  
 210.2        12  IN     01 08 00 00  00 00 00 03  00 00 00 00               ............      5.9ms        83.1.0        2023/05/31  10:59:47.562  
 210.2        12  IN     01 08 00 00  00 00 00 03  00 00 00 00               ............      6.1ms        84.1.0        2023/05/31  10:59:47.568  
 210.2        12  IN     01 08 00 00  00 00 00 03  00 00 00 00               ............      8.0ms        85.1.0        2023/05/31  10:59:47.575  
 210.2        12  IN     01 08 00 00  00 00 00 03  00 00 00 00               ............      5.9ms        86.1.0        2023/05/31  10:59:47.579  
 210.2        12  IN     01 08 00 00  00 00 00 03  00 00 00 00               ............      6.0ms        87.1.0        2023/05/31  10:59:47.579  
 210.2        12  IN     01 08 00 00  00 00 00 03  00 00 00 00               ............      5.9ms        88.1.0        2023/05/31  10:59:47.579  
 210.2        12  IN     01 08 00 00  00 00 00 03  00 00 00 00               ............      8.0ms        89.1.0        2023/05/31  10:59:47.594  
 210.2        12  IN     01 08 00 00  00 00 00 03  00 00 00 00               ............      5.9ms        90.1.0        2023/05/31  10:59:47.594  
 210.2        12  IN     01 08 00 00  00 00 00 03  00 00 00 00               ............      6.0ms        91.1.0        2023/05/31  10:59:47.609  
 210.2        12  IN     01 08 00 00  00 00 00 03  00 00 00 00               ............      5.9ms        92.1.0        2023/05/31  10:59:47.609  
 210.2        12  IN     01 08 00 00  00 00 00 03  00 00 00 00               ............      8.0ms        93.1.0        2023/05/31  10:59:47.626  
 210.2        12  IN     01 08 00 00  00 00 00 03  00 00 00 00               ............      5.9ms        94.1.0        2023/05/31  10:59:47.626  
 210.2        12  IN     01 08 00 00  00 00 00 03  00 00 00 00               ............      6.0ms        95.1.0        2023/05/31  10:59:47.626  
 210.2        12  IN     01 08 00 00  00 00 00 03  00 00 00 00               ............      6.0ms        96.1.0        2023/05/31  10:59:47.641  
 210.2        12  IN     01 08 00 00  00 00 00 03  00 00 00 00               ............      8.0ms        97.1.0        2023/05/31  10:59:47.641  
 210.2        12  IN     01 08 00 00  00 00 00 03  00 00 00 00               ............      5.9ms        98.1.0        2023/05/31  10:59:47.656  
 210.2        12  IN     01 08 00 00  00 00 00 03  00 00 00 00               ............      5.9ms        99.1.0        2023/05/31  10:59:47.656  
 210.2        12  IN     01 08 00 00  00 00 00 03  00 00 00 00               ............      6.0ms       100.1.0        2023/05/31  10:59:47.671  
 210.2        12  IN     01 08 00 00  00 00 00 03  00 00 00 00               ............      7.9ms       101.1.0        2023/05/31  10:59:47.671  
 210.2        12  IN     01 08 00 00  00 00 00 03  00 00 00 00               ............      5.9ms       102.1.0        2023/05/31  10:59:47.671  
 210.2        12  IN     01 08 00 00  00 00 00 03  00 00 00 00               ............      5.9ms       103.1.0        2023/05/31  10:59:47.686  
 210.2        12  IN     01 08 00 00  00 00 00 03  00 00 00 00               ............      6.0ms       104.1.0        2023/05/31  10:59:47.686  
 210.2        12  IN     01 08 00 00  00 00 00 03  00 00 00 00               ............      7.9ms       105.1.0        2023/05/31  10:59:47.701  
 210.2        12  IN     01 08 00 00  00 00 00 03  00 00 00 00               ............      5.9ms       106.1.0        2023/05/31  10:59:47.701  
 210.2        12  IN     01 08 00 00  00 00 00 03  00 00 00 00               ............      6.0ms       107.1.0        2023/05/31  10:59:47.716  
 210.2        12  IN     01 08 00 00  00 00 00 03  00 00 00 00               ............      5.9ms       108.1.0        2023/05/31  10:59:47.716  
 210.2        12  IN     01 08 00 00  00 00 00 03  00 00 00 00               ............      7.9ms       109.1.0        2023/05/31  10:59:47.732  
 210.2        12  IN     01 08 00 00  00 00 00 03  00 00 00 00               ............      6.0ms       110.1.0        2023/05/31  10:59:47.738  
 210.2        12  IN     01 08 00 00  00 00 00 03  00 00 00 00               ............      5.9ms       111.1.0        2023/05/31  10:59:47.744  
 210.2        12  IN     01 08 00 00  00 00 00 03  00 00 00 00               ............      6.0ms       112.1.0        2023/05/31  10:59:47.750  
 210.2        12  IN     01 08 00 00  00 00 00 03  00 00 00 00               ............      7.9ms       113.1.0        2023/05/31  10:59:47.758  
 210.2        12  IN     01 08 00 00  00 00 00 03  00 00 00 00               ............      5.9ms       114.1.0        2023/05/31  10:59:47.764  
 210.2        12  IN     01 08 00 00  00 00 00 03  00 00 00 00               ............      6.1ms       115.1.0        2023/05/31  10:59:47.769  
 210.2        12  IN     01 08 00 00  00 00 00 03  00 00 00 00               ............      5.9ms       116.1.0        2023/05/31  10:59:47.775  
 210.2        12  IN     01 08 00 00  00 00 00 03  00 00 00 00               ............      8.0ms       117.1.0        2023/05/31  10:59:47.783  
 210.2        12  IN     01 08 00 00  00 00 00 03  00 00 00 00               ............      6.0ms       118.1.0        2023/05/31  10:59:47.790  
 210.2        12  IN     01 08 00 00  00 00 00 03  00 00 00 00               ............      5.9ms       119.1.0        2023/05/31  10:59:47.796  
 210.2        12  IN     01 08 00 00  00 00 00 03  00 00 00 00               ............      6.0ms       120.1.0        2023/05/31  10:59:47.802  
 210.2        12  IN     01 08 00 00  00 00 00 03  00 00 00 00               ............      7.9ms       121.1.0        2023/05/31  10:59:47.810  
 210.2        12  IN     01 08 00 00  00 00 00 03  00 00 00 00               ............      7.9ms       122.1.0        2023/05/31  10:59:47.812  
 210.2        12  IN     01 08 00 00  00 00 00 03  00 00 00 00               ............      5.9ms       123.1.0        2023/05/31  10:59:47.812  
 210.2        12  IN     01 08 00 00  00 00 00 03  00 00 00 00               ............      5.9ms       124.1.0        2023/05/31  10:59:47.830  
 210.2        12  IN     01 08 00 00  00 00 00 03  00 00 00 00               ............      8.0ms       125.1.0        2023/05/31  10:59:47.837  
 210.2        12  IN     01 08 00 00  00 00 00 03  00 00 00 00               ............      5.9ms       126.1.0        2023/05/31  10:59:47.843  
 210.2        12  IN     01 08 00 00  00 00 00 03  00 00 00 00               ............      6.0ms       127.1.0        2023/05/31  10:59:47.847  
 210.2         3  IN     04 83 01                                            ...               4.0ms       128.1.0        2023/05/31  10:59:47.847  
 210.2        12  IN     01 08 00 00  00 00 00 03  00 00 00 00               ............      5.8ms       129.1.0        2023/05/31  10:59:47.847  
 210.2        12  IN     01 08 00 00  00 00 00 03  00 00 00 00               ............      6.0ms       130.1.0        2023/05/31  10:59:47.862  
 210.2        12  IN     01 08 00 00  00 00 00 03  00 00 00 00               ............      6.0ms       131.1.0        2023/05/31  10:59:47.862  
 210.2        12  IN     01 08 00 00  00 00 00 03  00 00 00 00               ............      5.9ms       132.1.0        2023/05/31  10:59:47.877  
 210.2        12  IN     01 08 00 00  00 00 00 03  00 00 00 00               ............      7.9ms       133.1.0        2023/05/31  10:59:47.877  
 210.2        12  IN     01 08 00 00  00 00 00 03  00 00 00 00               ............      6.0ms       134.1.0        2023/05/31  10:59:47.890  
 210.2        12  IN     01 08 00 00  00 00 00 03  00 00 00 00               ............      6.0ms       135.1.0        2023/05/31  10:59:47.897  
 210.2        12  IN     01 08 00 00  00 00 00 03  00 00 00 00               ............      5.9ms       136.1.0        2023/05/31  10:59:47.903  
 210.2        12  IN     01 08 00 00  00 00 00 03  00 00 00 00               ............      8.0ms       137.1.0        2023/05/31  10:59:47.911  
 210.2        12  IN     01 08 00 00  00 00 00 03  00 00 00 00               ............      6.0ms       138.1.0        2023/05/31  10:59:47.917  
 210.2        12  IN     01 08 00 00  00 00 00 03  00 00 00 00               ............      6.0ms       139.1.0        2023/05/31  10:59:47.923  
 210.2        12  IN     01 08 00 00  00 00 00 03  00 00 00 00               ............      5.9ms       140.1.0        2023/05/31  10:59:47.929  
 210.2        12  IN     01 08 00 00  00 00 00 03  00 00 00 00               ............      8.0ms       141.1.0        2023/05/31  10:59:47.937  
 210.2        12  IN     01 08 00 00  00 00 00 03  00 00 00 00               ............      6.0ms       142.1.0        2023/05/31  10:59:47.943  
 210.2        12  IN     01 08 00 00  00 00 00 03  00 00 00 00               ............      5.9ms       143.1.0        2023/05/31  10:59:47.949  
 210.2        12  IN     01 08 00 00  00 00 00 03  00 00 00 00               ............      6.0ms       144.1.0        2023/05/31  10:59:47.955  
 210.2        12  IN     01 08 00 00  00 00 00 03  00 00 00 00               ............      9.0ms       145.1.0        2023/05/31  10:59:47.964  
 210.2        12  IN     01 08 00 00  00 00 00 03  00 00 00 00               ............      4.9ms       146.1.0        2023/05/31  10:59:47.969  
 210.2        12  IN     01 08 00 00  00 00 00 03  00 00 00 00               ............      5.9ms       147.1.0        2023/05/31  10:59:47.975  
 210.2        12  IN     01 08 00 00  00 00 00 03  00 00 00 00               ............      6.0ms       148.1.0        2023/05/31  10:59:47.981  
 210.2        12  IN     01 08 00 00  00 00 00 03  00 00 00 00               ............      8.0ms       149.1.0        2023/05/31  10:59:47.989  
 210.2        12  IN     01 08 00 00  00 00 00 03  00 00 00 00               ............      6.0ms       150.1.0        2023/05/31  10:59:47.996  
 210.2        12  IN     01 08 00 00  00 00 00 03  00 00 00 00               ............      5.9ms       151.1.0        2023/05/31  10:59:47.996  
 210.2        12  IN     01 08 00 00  00 00 00 03  00 00 00 00               ............      6.0ms       152.1.0        2023/05/31  10:59:47.996  
 210.2        12  IN     01 08 00 00  00 00 00 03  00 00 00 00               ............      7.9ms       153.1.0        2023/05/31  10:59:48.016  
 210.2        12  IN     01 08 00 00  00 00 00 03  00 00 00 00               ............      7.0ms       154.1.0        2023/05/31  10:59:48.023  
 210.2        12  IN     01 08 00 00  00 00 00 03  00 00 00 00               ............      4.9ms       155.1.0        2023/05/31  10:59:48.028  
 210.2        12  IN     01 08 00 00  00 00 00 03  00 00 00 00               ............      6.0ms       156.1.0        2023/05/31  10:59:48.032  
 210.2        12  IN     01 08 00 00  00 00 00 03  00 00 00 00               ............      8.0ms       157.1.0        2023/05/31  10:59:48.032  
 210.2        12  IN     01 08 00 00  00 00 00 03  00 00 00 00               ............      7.0ms       158.1.0        2023/05/31  10:59:48.047  
 210.2        12  IN     01 08 00 00  00 00 00 03  00 00 00 00               ............      4.9ms       159.1.0        2023/05/31  10:59:48.047  
 210.2        12  IN     01 08 00 00  00 00 00 03  00 00 00 00               ............      6.0ms       160.1.0        2023/05/31  10:59:48.047  
 210.2        12  IN     01 08 00 00  00 00 00 03  00 00 00 00               ............      8.0ms       161.1.0        2023/05/31  10:59:48.062  
 210.2        12  IN     01 08 00 00  00 00 00 03  00 00 00 00               ............      6.0ms       162.1.0        2023/05/31  10:59:48.062  
 210.2        12  IN     01 08 00 00  00 00 00 03  00 00 00 00               ............      5.9ms       163.1.0        2023/05/31  10:59:48.077  
 210.2        12  IN     01 08 00 00  00 00 00 03  00 00 00 00               ............      5.9ms       164.1.0        2023/05/31  10:59:48.077  
 210.2        12  IN     01 08 00 00  00 00 00 03  00 00 00 00               ............      7.9ms       165.1.0        2023/05/31  10:59:48.092  
 210.2         3  IN     04 00 00                                            ...               4.0ms       166.1.0        2023/05/31  10:59:48.092  
 210.2        12  IN     01 08 00 00  00 00 00 03  00 00 00 00               ............      5.0ms       167.1.0        2023/05/31  10:59:48.092  
 210.2        12  IN     01 08 00 00  00 00 00 03  00 00 00 00               ............      7.0ms       168.1.0        2023/05/31  10:59:48.107  
 210.2        12  IN     01 08 00 00  00 00 00 03  00 00 00 00               ............      6.0ms       169.1.0        2023/05/31  10:59:48.107  
 210.2        12  IN     01 08 00 00  00 00 00 03  00 00 00 00               ............      5.9ms       170.1.0        2023/05/31  10:59:48.122  
 210.2        12  IN     01 08 00 00  00 00 00 03  00 00 00 00               ............      6.9ms       171.1.0        2023/05/31  10:59:48.128  
 210.2        12  IN     01 08 00 00  00 00 00 03  00 00 00 00               ............      6.9ms       172.1.0        2023/05/31  10:59:48.135  
 210.2        12  IN     01 08 00 00  00 00 00 03  00 00 00 00               ............      6.0ms       173.1.0        2023/05/31  10:59:48.141  
 210.2        12  IN     01 08 00 00  00 00 00 03  00 00 00 00               ............      5.0ms       174.1.0        2023/05/31  10:59:48.146  
 210.2        12  IN     01 08 00 00  00 00 00 03  00 00 00 00               ............      8.0ms       175.1.0        2023/05/31  10:59:48.154  
 210.2        12  IN     01 08 00 00  00 00 00 03  00 00 00 00               ............      7.0ms       176.1.0        2023/05/31  10:59:48.161  
 210.2        12  IN     01 08 00 00  00 00 00 03  00 00 00 00               ............      4.9ms       177.1.0        2023/05/31  10:59:48.163  
 210.2        12  IN     01 08 00 00  00 00 00 03  00 00 00 00               ............      6.9ms       178.1.0        2023/05/31  10:59:48.173  
 210.2        12  IN     01 08 00 00  00 00 00 03  00 00 00 00               ............      8.0ms       179.1.0        2023/05/31  10:59:48.181  
 210.2        12  IN     01 08 00 00  00 00 00 03  00 00 00 00               ............      5.9ms       180.1.0        2023/05/31  10:59:48.187  
 210.2        12  IN     01 08 00 00  00 00 00 03  00 00 00 00               ............      6.0ms       181.1.0        2023/05/31  10:59:48.194  
 210.2        12  IN     01 08 00 00  00 00 00 03  00 00 00 00               ............      6.0ms       182.1.0        2023/05/31  10:59:48.200  
 210.2        12  IN     01 08 00 00  00 00 00 03  00 00 00 00               ............      8.0ms       183.1.0        2023/05/31  10:59:48.208  
 210.2        12  IN     01 08 00 00  00 00 00 03  00 00 00 00               ............      6.9ms       184.1.0        2023/05/31  10:59:48.208  
 210.2        12  IN     01 08 00 00  00 00 00 03  00 00 00 00               ............      5.0ms       185.1.0        2023/05/31  10:59:48.208  
 210.2        12  IN     01 08 00 00  00 00 00 03  00 00 00 00               ............      5.9ms       186.1.0        2023/05/31  10:59:48.223  
 210.2        12  IN     01 08 00 00  00 00 00 03  00 00 00 00               ............      8.0ms       187.1.0        2023/05/31  10:59:48.223  
 210.2        12  IN     01 08 00 00  00 00 00 03  00 00 00 00               ............      5.9ms       188.1.0        2023/05/31  10:59:48.238  
 210.2        12  IN     01 08 00 00  00 00 00 03  00 00 00 00               ............      6.0ms       189.1.0        2023/05/31  10:59:48.238  
 210.2        12  IN     01 08 00 00  00 00 00 03  00 00 00 00               ............      6.0ms       190.1.0        2023/05/31  10:59:48.238  
 210.2        12  IN     01 08 00 00  00 00 00 03  00 00 00 00               ............      7.9ms       191.1.0        2023/05/31  10:59:48.259  
 210.2        12  IN     01 08 00 00  00 00 00 03  00 00 00 00               ............      6.9ms       192.1.0        2023/05/31  10:59:48.266  
 210.2        12  IN     01 08 00 00  00 00 00 03  00 00 00 00               ............      4.9ms       193.1.0        2023/05/31  10:59:48.270  
 210.2        12  IN     01 08 00 00  00 00 00 03  00 00 00 00               ............      6.0ms       194.1.0        2023/05/31  10:59:48.270  
 210.2        12  IN     01 08 00 00  00 00 00 03  00 00 00 00               ............      7.9ms       195.1.0        2023/05/31  10:59:48.285  
 210.2        12  IN     01 08 00 00  00 00 00 03  00 00 00 00               ............      6.0ms       196.1.0        2023/05/31  10:59:48.285  
 210.2        12  IN     01 08 00 00  00 00 00 03  00 00 00 00               ............      6.0ms       197.1.0        2023/05/31  10:59:48.285  
 210.2        12  IN     01 08 00 00  00 00 00 03  00 00 00 00               ............      5.9ms       198.1.0        2023/05/31  10:59:48.300  
 210.2        12  IN     01 08 00 00  00 00 00 03  00 00 00 00               ............      8.0ms       199.1.0        2023/05/31  10:59:48.300  
 210.2        12  IN     01 08 00 00  00 00 00 03  00 00 00 00               ............      7.0ms       200.1.0        2023/05/31  10:59:48.315  
 210.2        12  IN     01 08 00 00  00 00 00 03  00 00 00 00               ............      4.9ms       201.1.0        2023/05/31  10:59:48.315  
 210.2        12  IN     01 08 00 00  00 00 00 03  00 00 00 00               ............      6.0ms       202.1.0        2023/05/31  10:59:48.315  
 210.2        12  IN     01 08 00 00  00 00 00 03  00 00 00 00               ............      8.0ms       203.1.0        2023/05/31  10:59:48.338  
 210.2        12  IN     01 08 00 00  00 00 00 03  00 00 00 00               ............      5.9ms       204.1.0        2023/05/31  10:59:48.344  
 210.2        12  IN     01 08 00 00  00 00 00 03  00 00 00 00               ............      6.0ms       205.1.0        2023/05/31  10:59:48.350  
 210.2        12  IN     01 08 00 00  00 00 00 03  00 00 00 00               ............      6.0ms       206.1.0        2023/05/31  10:59:48.356  
 210.2        12  IN     01 08 00 00  00 00 00 03  00 00 00 00               ............      8.0ms       207.1.0        2023/05/31  10:59:48.364  
 210.2        12  IN     01 08 00 00  00 00 00 03  00 00 00 00               ............      5.9ms       208.1.0        2023/05/31  10:59:48.370  
 210.2        12  IN     01 08 00 00  00 00 00 03  00 00 00 00               ............      6.0ms       209.1.0        2023/05/31  10:59:48.376  
 210.2        12  IN     01 08 00 00  00 00 00 03  00 00 00 00               ............      6.0ms       210.1.0        2023/05/31  10:59:48.381  
 210.2        12  IN     01 08 00 00  00 00 00 03  00 00 00 00               ............      7.9ms       211.1.0        2023/05/31  10:59:48.381  
 210.2        12  IN     01 08 00 00  00 00 00 03  00 00 00 00               ............      5.9ms       212.1.0        2023/05/31  10:59:48.396  
 210.2        12  IN     01 08 00 00  00 00 00 03  00 00 00 00               ............      6.0ms       213.1.0        2023/05/31  10:59:48.396  
 210.2        12  IN     01 08 00 00  00 00 00 03  00 00 00 00               ............      6.0ms       214.1.0        2023/05/31  10:59:48.396  
 210.2        12  IN     01 08 00 00  00 00 00 03  00 00 00 00               ............      7.9ms       215.1.0        2023/05/31  10:59:48.411  
 210.2        12  IN     01 08 00 00  00 00 00 03  00 00 00 00               ............      5.9ms       216.1.0        2023/05/31  10:59:48.411  
 210.2        12  IN     01 08 00 00  00 00 00 03  00 00 00 00               ............      6.0ms       217.1.0        2023/05/31  10:59:48.426  
 210.2        12  IN     01 00 00 00  00 00 00 03  00 00 00 00               ............      3.9ms       218.1.0        2023/05/31  10:59:48.426  
 210.2         3  IN     04 83 01                                            ...               1.5sc       219.1.0        2023/05/31  10:59:49.981  
 210.2        12  IN     01 00 00 00  01 00 00 03  00 00 00 00               ............       45ms       220.1.0        2023/05/31  10:59:50.028  
 210.2         3  IN     04 00 00                                            ...               126ms       221.1.0        2023/05/31  10:59:50.154  
 210.2         3  IN     04 83 01                                            ...               1.6sc       222.1.0        2023/05/31  10:59:51.834  
 210.2         3  IN     04 00 00                                            ...               313ms       223.1.0        2023/05/31  10:59:52.148  
 210.2         3  IN     04 83 01                                            ...               3.6sc       224.1.0        2023/05/31  10:59:55.775  
 210.2         3  IN     04 00 00                                            ...               281ms       225.1.0        2023/05/31  10:59:56.056  
 210.2        12  IN     01 00 ff ff  00 00 00 03  00 00 00 00               ............      4.2sc       226.1.0        2023/05/31  11:00:00.309  
 210.2        12  IN     01 00 ff ff  00 00 00 03  00 00 00 00               ............      1.0ms       227.1.0        2023/05/31  11:00:00.310  
 210.2        12  IN     01 00 ff ff  00 00 00 03  00 00 00 00               ............      986us       228.1.0        2023/05/31  11:00:00.311  
 210.2        12  IN     01 00 00 00  ff ff 00 03  00 00 00 00               ............      1.9ms       229.1.0        2023/05/31  11:00:00.313  
 210.2        12  IN     01 00 ff ff  00 00 00 03  00 00 00 00               ............      1.0ms       230.1.0        2023/05/31  11:00:00.314  
 210.2        12  IN     01 00 ff ff  00 00 00 03  00 00 00 00               ............      2.9ms       231.1.0        2023/05/31  11:00:00.317  
 210.2        12  IN     01 00 ff ff  00 00 00 03  00 00 00 00               ............      7.0ms       232.1.0        2023/05/31  11:00:00.324  
 210.2        12  IN     01 00 00 00  ff ff 00 03  00 00 00 00               ............       72ms       233.1.0        2023/05/31  11:00:00.397  
 210.2        12  IN     01 08 00 00  00 00 00 03  00 00 00 00               ............      163ms       234.1.0        2023/05/31  11:00:00.561  
 210.2        12  IN     01 08 00 00  00 00 00 03  00 00 00 00               ............      6.0ms       235.1.0        2023/05/31  11:00:00.566  
 210.2        12  IN     01 08 00 00  00 00 00 03  00 00 00 00               ............      6.0ms       236.1.0        2023/05/31  11:00:00.572  
 210.2        12  IN     01 08 00 00  00 00 00 03  00 00 00 00               ............      5.9ms       237.1.0        2023/05/31  11:00:00.578  
 210.2        12  IN     01 08 00 00  00 00 00 03  00 00 00 00               ............      6.0ms       238.1.0        2023/05/31  11:00:00.585  
 210.2        12  IN     01 08 00 00  00 00 00 03  00 00 00 00               ............      7.9ms       239.1.0        2023/05/31  11:00:00.592  
 210.2        12  IN     01 08 00 00  ff ff 00 03  00 00 00 00               ............      6.0ms       240.1.0        2023/05/31  11:00:00.599  
 210.2        12  IN     01 08 00 00  00 00 00 03  00 00 00 00               ............      5.9ms       241.1.0        2023/05/31  11:00:00.604  
 210.2        12  IN     01 08 00 00  00 00 00 03  00 00 00 00               ............      6.0ms       242.1.0        2023/05/31  11:00:00.610  
 210.2        12  IN     01 08 00 00  00 00 00 03  00 00 00 00               ............      6.0ms       243.1.0        2023/05/31  11:00:00.617  
 210.2        12  IN     01 08 00 00  00 00 00 03  00 00 00 00               ............      5.9ms       244.1.0        2023/05/31  11:00:00.623  
 210.2        12  IN     01 08 00 00  ff ff 00 03  00 00 00 00               ............      7.9ms       245.1.0        2023/05/31  11:00:00.630  
 210.2        12  IN     01 08 00 00  00 00 00 03  00 00 00 00               ............      5.9ms       246.1.0        2023/05/31  11:00:00.636  
 210.2        12  IN     01 08 00 00  00 00 00 03  00 00 00 00               ............      5.9ms       247.1.0        2023/05/31  11:00:00.642  
 210.2        12  IN     01 08 00 00  00 00 00 03  00 00 00 00               ............      6.1ms       248.1.0        2023/05/31  11:00:00.648  
 210.2        12  IN     01 08 00 00  00 00 00 03  00 00 00 00               ............      5.9ms       249.1.0        2023/05/31  11:00:00.654  
 210.2        12  IN     01 08 00 00  00 00 00 03  00 00 00 00               ............      7.9ms       250.1.0        2023/05/31  11:00:00.662  
 210.2        12  IN     01 08 00 00  00 00 00 03  00 00 00 00               ............      6.0ms       251.1.0        2023/05/31  11:00:00.668  
 210.2        12  IN     01 08 00 00  00 00 00 03  00 00 00 00               ............      6.0ms       252.1.0        2023/05/31  11:00:00.674  
 210.2        12  IN     01 08 00 00  00 00 00 03  00 00 00 00               ............      6.0ms       253.1.0        2023/05/31  11:00:00.680  
 210.2        12  IN     01 08 00 00  00 00 00 03  00 00 00 00               ............      7.9ms       254.1.0        2023/05/31  11:00:00.689  
 210.2        12  IN     01 08 00 00  00 00 00 03  00 00 00 00               ............      5.9ms       255.1.0        2023/05/31  11:00:00.695  
 210.2        12  IN     01 08 00 00  00 00 00 03  00 00 00 00               ............      5.9ms       256.1.0        2023/05/31  11:00:00.700  
 210.2        12  IN     01 08 00 00  00 00 00 03  00 00 00 00               ............      6.0ms       257.1.0        2023/05/31  11:00:00.707  
 210.2        12  IN     01 08 00 00  00 00 00 03  00 00 00 00               ............      7.9ms       258.1.0        2023/05/31  11:00:00.714  
 210.2        12  IN     01 08 00 00  00 00 00 03  00 00 00 00               ............      7.9ms       259.1.0        2023/05/31  11:00:00.722  
 210.2        12  IN     01 08 00 00  00 00 00 03  00 00 00 00               ............      4.0ms       260.1.0        2023/05/31  11:00:00.726  
 210.2        12  IN     01 08 00 00  00 00 00 03  00 00 00 00               ............      6.0ms       261.1.0        2023/05/31  11:00:00.733  
 210.2        12  IN     01 08 00 00  00 00 00 03  00 00 00 00               ............      7.9ms       262.1.0        2023/05/31  11:00:00.741  
 210.2        12  IN     01 08 00 00  00 00 00 03  00 00 00 00               ............      6.9ms       263.1.0        2023/05/31  11:00:00.748  
 210.2        12  IN     01 08 00 00  00 00 00 03  00 00 00 00               ............      5.0ms       264.1.0        2023/05/31  11:00:00.753  
 210.2        12  IN     01 08 00 00  00 00 00 03  00 00 00 00               ............      7.9ms       265.1.0        2023/05/31  11:00:00.761  
 210.2        12  IN     01 08 00 00  00 00 00 03  00 00 00 00               ............      5.9ms       266.1.0        2023/05/31  11:00:00.767  
 210.2        12  IN     01 08 00 00  00 00 00 03  00 00 00 00               ............      6.0ms       267.1.0        2023/05/31  11:00:00.773  
 210.2        12  IN     01 08 00 00  00 00 00 03  00 00 00 00               ............      6.1ms       268.1.0        2023/05/31  11:00:00.779  
 210.2        12  IN     01 08 00 00  00 00 00 03  00 00 00 00               ............      5.9ms       269.1.0        2023/05/31  11:00:00.785  
 210.2        12  IN     01 08 00 00  00 00 00 03  00 00 00 00               ............      7.9ms       270.1.0        2023/05/31  11:00:00.793  
 210.2        12  IN     01 08 00 00  00 00 00 03  00 00 00 00               ............      6.0ms       271.1.0        2023/05/31  11:00:00.799  
 210.2        12  IN     01 08 00 00  00 00 00 03  00 00 00 00               ............      7.0ms       272.1.0        2023/05/31  11:00:00.806  
 210.2        12  IN     01 08 00 00  00 00 00 03  00 00 00 00               ............      6.0ms       273.1.0        2023/05/31  11:00:00.812  
 210.2        12  IN     01 08 00 00  00 00 00 03  00 00 00 00               ............      7.9ms       274.1.0        2023/05/31  11:00:00.819  
 210.2        12  IN     01 08 00 00  00 00 00 03  00 00 00 00               ............      4.9ms       275.1.0        2023/05/31  11:00:00.824  
 210.2        12  IN     01 08 00 00  00 00 00 03  00 00 00 00               ............      6.0ms       276.1.0        2023/05/31  11:00:00.831  
 210.2        12  IN     01 08 00 00  00 00 00 03  00 00 00 00               ............      6.0ms       277.1.0        2023/05/31  11:00:00.837  
 210.2        12  IN     01 08 00 00  00 00 00 03  00 00 00 00               ............      7.9ms       278.1.0        2023/05/31  11:00:00.844  
 210.2        12  IN     01 08 00 00  00 00 00 03  00 00 00 00               ............      7.0ms       279.1.0        2023/05/31  11:00:00.851  
 210.2        12  IN     01 08 00 00  00 00 00 03  00 00 00 00               ............      4.9ms       280.1.0        2023/05/31  11:00:00.856  
 210.2        12  IN     01 08 00 00  00 00 00 03  00 00 00 00               ............      6.9ms       281.1.0        2023/05/31  11:00:00.863  
 210.2        12  IN     01 08 00 00  00 00 00 03  00 00 00 00               ............      6.9ms       282.1.0        2023/05/31  11:00:00.871  
 210.2        12  IN     01 08 00 00  00 00 00 03  00 00 00 00               ............      6.0ms       283.1.0        2023/05/31  11:00:00.876  
 210.2        12  IN     01 08 00 00  00 00 00 03  00 00 00 00               ............      5.9ms       284.1.0        2023/05/31  11:00:00.882  
 210.2        12  IN     01 08 00 00  00 00 00 03  00 00 00 00               ............      6.9ms       285.1.0        2023/05/31  11:00:00.889  
 210.2        12  IN     01 08 00 00  00 00 00 03  00 00 00 00               ............      6.9ms       286.1.0        2023/05/31  11:00:00.896  
 210.2        12  IN     01 08 00 00  00 00 00 03  00 00 00 00               ............      6.9ms       287.1.0        2023/05/31  11:00:00.903  
 210.2        12  IN     01 08 00 00  00 00 00 03  00 00 00 00               ............      5.0ms       288.1.0        2023/05/31  11:00:00.909  
 210.2        12  IN     01 08 00 00  00 00 00 03  00 00 00 00               ............      5.9ms       289.1.0        2023/05/31  11:00:00.914  
 210.2        12  IN     01 08 00 00  00 00 00 03  00 00 00 00               ............      8.9ms       290.1.0        2023/05/31  11:00:00.923  
 210.2        12  IN     01 08 00 00  00 00 00 03  00 00 00 00               ............      6.0ms       291.1.0        2023/05/31  11:00:00.930  
 210.2        12  IN     01 08 00 00  00 00 00 03  00 00 00 00               ............      4.9ms       292.1.0        2023/05/31  11:00:00.934  
 210.2        12  IN     01 08 00 00  00 00 00 03  00 00 00 00               ............      6.9ms       293.1.0        2023/05/31  11:00:00.941  
 210.2        12  IN     01 08 00 00  00 00 00 03  00 00 00 00               ............      7.0ms       294.1.0        2023/05/31  11:00:00.948  
 210.2        12  IN     01 08 00 00  00 00 00 03  00 00 00 00               ............      6.9ms       295.1.0        2023/05/31  11:00:00.955  
 210.2        12  IN     01 08 00 00  00 00 00 03  00 00 00 00               ............      7.1ms       296.1.0        2023/05/31  11:00:00.963  
 210.2        12  IN     01 08 00 00  00 00 00 03  00 00 00 00               ............      4.0ms       297.1.0        2023/05/31  11:00:00.967  
 210.2        12  IN     01 08 00 00  00 00 00 03  00 00 00 00               ............      7.9ms       298.1.0        2023/05/31  11:00:00.975  
 210.2        12  IN     01 08 00 00  00 00 00 03  00 00 00 00               ............      7.0ms       299.1.0        2023/05/31  11:00:00.982  
 210.2        12  IN     01 08 00 00  00 00 00 03  00 00 00 00               ............      6.0ms       300.1.0        2023/05/31  11:00:00.988  
 210.2        12  IN     01 08 00 00  00 00 00 03  00 00 00 00               ............      6.0ms       301.1.0        2023/05/31  11:00:00.994  
 210.2        12  IN     01 08 00 00  00 00 00 03  00 00 00 00               ............      6.9ms       302.1.0        2023/05/31  11:00:01.000  
 210.2        12  IN     01 08 00 00  00 00 00 03  00 00 00 00               ............      6.9ms       303.1.0        2023/05/31  11:00:01.007  
 210.2        12  IN     01 08 00 00  00 00 00 03  00 00 00 00               ............      6.1ms       304.1.0        2023/05/31  11:00:01.014  
 210.2        12  IN     01 08 00 00  00 00 00 03  00 00 00 00               ............      5.9ms       305.1.0        2023/05/31  11:00:01.020  
 210.2        12  IN     01 08 00 00  00 00 00 03  00 00 00 00               ............      7.9ms       306.1.0        2023/05/31  11:00:01.028  
 210.2        12  IN     01 08 00 00  00 00 00 03  00 00 00 00               ............      6.0ms       307.1.0        2023/05/31  11:00:01.033  
 210.2        12  IN     01 08 00 00  00 00 00 03  00 00 00 00               ............      5.9ms       308.1.0        2023/05/31  11:00:01.040  
 210.2        12  IN     01 08 00 00  00 00 00 03  00 00 00 00               ............      6.0ms       309.1.0        2023/05/31  11:00:01.046  
 210.2        12  IN     01 08 00 00  00 00 00 03  00 00 00 00               ............      7.9ms       310.1.0        2023/05/31  11:00:01.054  
 210.2        12  IN     01 08 00 00  00 00 00 03  00 00 00 00               ............      7.0ms       311.1.0        2023/05/31  11:00:01.061  
 210.2         3  IN     04 83 01                                            ...               4.0ms       312.1.0        2023/05/31  11:00:01.065  
 210.2        12  IN     01 08 00 00  00 00 00 03  00 00 00 00               ............      5.9ms       313.1.0        2023/05/31  11:00:01.071  
 210.2        12  IN     01 08 00 00  00 00 00 03  00 00 00 00               ............      5.9ms       314.1.0        2023/05/31  11:00:01.077  
 210.2        12  IN     01 08 00 00  00 00 00 03  00 00 00 00               ............      5.9ms       315.1.0        2023/05/31  11:00:01.083  
 210.2        12  IN     01 08 00 00  00 00 00 03  00 00 00 00               ............      5.9ms       316.1.0        2023/05/31  11:00:01.088  
 210.2        12  IN     01 08 00 00  00 00 00 03  00 00 00 00               ............      7.9ms       317.1.0        2023/05/31  11:00:01.096  
 210.2        12  IN     01 08 00 00  00 00 00 03  00 00 00 00               ............      6.0ms       318.1.0        2023/05/31  11:00:01.102  
 210.2        12  IN     01 08 00 00  00 00 00 03  00 00 00 00               ............      5.9ms       319.1.0        2023/05/31  11:00:01.108  
 210.2        12  IN     01 08 00 00  00 00 00 03  00 00 00 00               ............      6.0ms       320.1.0        2023/05/31  11:00:01.115  
 210.2        12  IN     01 08 00 00  00 00 00 03  00 00 00 00               ............      7.9ms       321.1.0        2023/05/31  11:00:01.123  
 210.2        12  IN     01 08 00 00  00 00 00 03  00 00 00 00               ............      6.0ms       322.1.0        2023/05/31  11:00:01.129  
 210.2        12  IN     01 08 00 00  00 00 00 03  00 00 00 00               ............      5.9ms       323.1.0        2023/05/31  11:00:01.135  
 210.2        12  IN     01 08 00 00  00 00 00 03  00 00 00 00               ............      5.9ms       324.1.0        2023/05/31  11:00:01.141  
 210.2        12  IN     01 08 00 00  00 00 00 03  00 00 00 00               ............      8.0ms       325.1.0        2023/05/31  11:00:01.149  
 210.2        12  IN     01 08 00 00  00 00 00 03  00 00 00 00               ............      5.9ms       326.1.0        2023/05/31  11:00:01.155  
 210.2        12  IN     01 08 00 00  00 00 00 03  00 00 00 00               ............      6.0ms       327.1.0        2023/05/31  11:00:01.161  
 210.2        12  IN     01 08 00 00  00 00 00 03  00 00 00 00               ............      6.0ms       328.1.0        2023/05/31  11:00:01.167  
 210.2        12  IN     01 08 00 00  00 00 00 03  00 00 00 00               ............      8.9ms       329.1.0        2023/05/31  11:00:01.176  
 210.2        12  IN     01 08 00 00  00 00 00 03  00 00 00 00               ............      5.9ms       330.1.0        2023/05/31  11:00:01.182  
 210.2        12  IN     01 08 00 00  00 00 00 03  00 00 00 00               ............      6.0ms       331.1.0        2023/05/31  11:00:01.188  
 210.2        12  IN     01 08 00 00  00 00 00 03  00 00 00 00               ............      6.0ms       332.1.0        2023/05/31  11:00:01.194  
 210.2        12  IN     01 08 00 00  00 00 00 03  00 00 00 00               ............      7.9ms       333.1.0        2023/05/31  11:00:01.202  
 210.2        12  IN     01 08 00 00  00 00 00 03  00 00 00 00               ............      6.0ms       334.1.0        2023/05/31  11:00:01.208  
 210.2        12  IN     01 08 00 00  00 00 00 03  00 00 00 00               ............      6.0ms       335.1.0        2023/05/31  11:00:01.214  
 210.2        12  IN     01 08 00 00  00 00 00 03  00 00 00 00               ............      5.9ms       336.1.0        2023/05/31  11:00:01.220  
 210.2        12  IN     01 08 00 00  00 00 00 03  00 00 00 00               ............       14ms       337.1.0        2023/05/31  11:00:01.233  
 210.2        12  IN     01 08 00 00  00 00 00 03  00 00 00 00               ............      4.0ms       338.1.0        2023/05/31  11:00:01.237  
 210.2        12  IN     01 08 00 00  00 00 00 03  00 00 00 00               ............      5.9ms       339.1.0        2023/05/31  11:00:01.243  
 210.2        12  IN     01 08 00 00  00 00 00 03  00 00 00 00               ............      6.0ms       340.1.0        2023/05/31  11:00:01.249  
 210.2        12  IN     01 08 00 00  00 00 00 03  00 00 00 00               ............      9.0ms       341.1.0        2023/05/31  11:00:01.258  
 210.2        12  IN     01 08 00 00  00 00 00 03  00 00 00 00               ............      4.9ms       342.1.0        2023/05/31  11:00:01.263  
 210.2        12  IN     01 08 00 00  00 00 00 03  00 00 00 00               ............      6.0ms       343.1.0        2023/05/31  11:00:01.269  
 210.2        12  IN     01 08 00 00  00 00 00 03  00 00 00 00               ............      5.9ms       344.1.0        2023/05/31  11:00:01.275  
 210.2        12  IN     01 08 00 00  00 00 00 03  00 00 00 00               ............      8.0ms       345.1.0        2023/05/31  11:00:01.283  
 210.2        12  IN     01 08 00 00  00 00 00 03  00 00 00 00               ............      5.9ms       346.1.0        2023/05/31  11:00:01.289  
 210.2        12  IN     01 08 00 00  00 00 00 03  00 00 00 00               ............      6.0ms       347.1.0        2023/05/31  11:00:01.295  
 210.2        12  IN     01 08 00 00  00 00 00 03  00 00 00 00               ............      6.0ms       348.1.0        2023/05/31  11:00:01.301  
 210.2        12  IN     01 08 00 00  00 00 00 03  00 00 00 00               ............      8.0ms       349.1.0        2023/05/31  11:00:01.309  
 210.2        12  IN     01 08 00 00  00 00 00 03  00 00 00 00               ............      5.9ms       350.1.0        2023/05/31  11:00:01.315  
 210.2        12  IN     01 08 00 00  00 00 00 03  00 00 00 00               ............      5.9ms       351.1.0        2023/05/31  11:00:01.321  
 210.2        12  IN     01 08 00 00  00 00 00 03  00 00 00 00               ............      5.9ms       352.1.0        2023/05/31  11:00:01.327  
 210.2        12  IN     01 08 00 00  00 00 00 03  00 00 00 00               ............      8.0ms       353.1.0        2023/05/31  11:00:01.335  
 210.2        12  IN     01 08 00 00  00 00 00 03  00 00 00 00               ............      6.0ms       354.1.0        2023/05/31  11:00:01.341  
 210.2        12  IN     01 08 00 00  00 00 00 03  00 00 00 00               ............      6.9ms       355.1.0        2023/05/31  11:00:01.348  
 210.2        12  IN     01 08 00 00  00 00 00 03  00 00 00 00               ............      6.0ms       356.1.0        2023/05/31  11:00:01.354  
 210.2        12  IN     01 08 00 00  00 00 00 03  00 00 00 00               ............      7.9ms       357.1.0        2023/05/31  11:00:01.362  
 210.2        12  IN     01 08 00 00  00 00 00 03  00 00 00 00               ............      5.9ms       358.1.0        2023/05/31  11:00:01.368  
 210.2        12  IN     01 08 00 00  00 00 00 03  00 00 00 00               ............      6.0ms       359.1.0        2023/05/31  11:00:01.374  
 210.2        12  IN     01 08 00 00  00 00 00 03  00 00 00 00               ............      6.0ms       360.1.0        2023/05/31  11:00:01.380  
 210.2        12  IN     01 08 00 00  00 00 00 03  00 00 00 00               ............      7.9ms       361.1.0        2023/05/31  11:00:01.388  
 210.2        12  IN     01 08 00 00  00 00 00 03  00 00 00 00               ............      6.0ms       362.1.0        2023/05/31  11:00:01.394  
 210.2        12  IN     01 08 00 00  00 00 00 03  00 00 00 00               ............      5.9ms       363.1.0        2023/05/31  11:00:01.400  
 210.2         3  IN     04 00 00                                            ...               2.9ms       364.1.0        2023/05/31  11:00:01.403  
 210.2        12  IN     01 08 00 00  00 00 00 03  00 00 00 00               ............      6.0ms       365.1.0        2023/05/31  11:00:01.409  
 210.2        12  IN     01 08 00 00  00 00 00 03  00 00 00 00               ............      6.0ms       366.1.0        2023/05/31  11:00:01.415  
 210.2        12  IN     01 08 00 00  00 00 00 03  00 00 00 00               ............      6.0ms       367.1.0        2023/05/31  11:00:01.421  
 210.2        12  IN     01 08 00 00  00 00 00 03  00 00 00 00               ............      5.9ms       368.1.0        2023/05/31  11:00:01.427  
 210.2        12  IN     01 08 00 00  00 00 00 03  00 00 00 00               ............      7.9ms       369.1.0        2023/05/31  11:00:01.435  
 210.2        12  IN     01 08 00 00  00 00 00 03  00 00 00 00               ............      6.0ms       370.1.0        2023/05/31  11:00:01.441  
 210.2        12  IN     01 08 00 00  00 00 00 03  00 00 00 00               ............      5.9ms       371.1.0        2023/05/31  11:00:01.447  
 210.2        12  IN     01 08 00 00  00 00 00 03  00 00 00 00               ............      6.0ms       372.1.0        2023/05/31  11:00:01.453  
 210.2        12  IN     01 08 00 00  00 00 00 03  00 00 00 00               ............      7.9ms       373.1.0        2023/05/31  11:00:01.461  
 210.2        12  IN     01 08 00 00  00 00 00 03  00 00 00 00               ............      6.0ms       374.1.0        2023/05/31  11:00:01.467  
 210.2        12  IN     01 08 00 00  00 00 00 03  00 00 00 00               ............      6.0ms       375.1.0        2023/05/31  11:00:01.473  
 210.2        12  IN     01 08 00 00  00 00 00 03  00 00 00 00               ............      6.9ms       376.1.0        2023/05/31  11:00:01.480  
 210.2        12  IN     01 08 00 00  00 00 00 03  00 00 00 00               ............      7.0ms       377.1.0        2023/05/31  11:00:01.487  
 210.2        12  IN     01 08 00 00  00 00 00 03  00 00 00 00               ............      6.0ms       378.1.0        2023/05/31  11:00:01.494  
 210.2        12  IN     01 08 00 00  00 00 00 03  00 00 00 00               ............      5.9ms       379.1.0        2023/05/31  11:00:01.500  
 210.2        12  IN     01 08 00 00  00 00 00 03  00 00 00 00               ............      5.9ms       380.1.0        2023/05/31  11:00:01.506  
 210.2        12  IN     01 08 00 00  00 00 00 03  00 00 00 00               ............      7.9ms       381.1.0        2023/05/31  11:00:01.514  
 210.2        12  IN     01 08 00 00  00 00 00 03  00 00 00 00               ............      6.0ms       382.1.0        2023/05/31  11:00:01.520  
 210.2        12  IN     01 08 00 00  00 00 00 03  00 00 00 00               ............      5.9ms       383.1.0        2023/05/31  11:00:01.526  
 210.2        12  IN     01 08 00 00  00 00 00 03  00 00 00 00               ............      5.9ms       384.1.0        2023/05/31  11:00:01.532  
 210.2        12  IN     01 08 00 00  00 00 00 03  00 00 00 00               ............      8.0ms       385.1.0        2023/05/31  11:00:01.540  
 210.2        12  IN     01 08 00 00  00 00 00 03  00 00 00 00               ............      6.0ms       386.1.0        2023/05/31  11:00:01.546  
 210.2        12  IN     01 08 00 00  00 00 00 03  00 00 00 00               ............      6.0ms       387.1.0        2023/05/31  11:00:01.551  
 210.2        12  IN     01 08 00 00  00 00 00 03  00 00 00 00               ............      5.9ms       388.1.0        2023/05/31  11:00:01.557  
 210.2        12  IN     01 08 00 00  00 00 00 03  00 00 00 00               ............      8.0ms       389.1.0        2023/05/31  11:00:01.566  
 210.2        12  IN     01 08 00 00  00 00 00 03  00 00 00 00               ............      5.9ms       390.1.0        2023/05/31  11:00:01.572  
 210.2        12  IN     01 08 00 00  00 00 00 03  00 00 00 00               ............      6.0ms       391.1.0        2023/05/31  11:00:01.578  
 210.2        12  IN     01 08 00 00  00 00 00 03  00 00 00 00               ............      5.9ms       392.1.0        2023/05/31  11:00:01.584  
 210.2        12  IN     01 08 00 00  00 00 00 03  00 00 00 00               ............      8.0ms       393.1.0        2023/05/31  11:00:01.592  
 210.2        12  IN     01 08 00 00  00 00 00 03  00 00 00 00               ............      6.9ms       394.1.0        2023/05/31  11:00:01.598  
 210.2        12  IN     01 08 00 00  00 00 00 03  00 00 00 00               ............      4.9ms       395.1.0        2023/05/31  11:00:01.604  
 210.2        12  IN     01 08 00 00  00 00 00 03  00 00 00 00               ............      6.0ms       396.1.0        2023/05/31  11:00:01.610  
 210.2        12  IN     01 08 00 00  00 00 00 03  00 00 00 00               ............      8.0ms       397.1.0        2023/05/31  11:00:01.618  
 210.2        12  IN     01 08 00 00  00 00 00 03  00 00 00 00               ............      5.9ms       398.1.0        2023/05/31  11:00:01.624  
 210.2        12  IN     01 08 00 00  00 00 00 03  00 00 00 00               ............      5.9ms       399.1.0        2023/05/31  11:00:01.629  
 210.2        12  IN     01 08 00 00  00 00 00 03  00 00 00 00               ............      6.0ms       400.1.0        2023/05/31  11:00:01.635  
 210.2        12  IN     01 08 00 00  00 00 00 03  00 00 00 00               ............      8.0ms       401.1.0        2023/05/31  11:00:01.643  
 210.2        12  IN     01 08 00 00  00 00 00 03  00 00 00 00               ............      6.0ms       402.1.0        2023/05/31  11:00:01.649  
 210.2        12  IN     01 08 00 00  00 00 00 03  00 00 00 00               ............      6.0ms       403.1.0        2023/05/31  11:00:01.655  
 210.2        12  IN     01 08 00 00  00 00 00 03  00 00 00 00               ............      5.9ms       404.1.0        2023/05/31  11:00:01.661  
 210.2        12  IN     01 08 00 00  00 00 00 03  00 00 00 00               ............      8.0ms       405.1.0        2023/05/31  11:00:01.669  
 210.2        12  IN     01 08 00 00  00 00 00 03  00 00 00 00               ............      5.9ms       406.1.0        2023/05/31  11:00:01.675  
 210.2        12  IN     01 08 00 00  00 00 00 03  00 00 00 00               ............      6.0ms       407.1.0        2023/05/31  11:00:01.681  
 210.2        12  IN     01 08 00 00  00 00 00 03  00 00 00 00               ............      5.9ms       408.1.0        2023/05/31  11:00:01.687  
 210.2        12  IN     01 08 00 00  00 00 00 03  00 00 00 00               ............      8.0ms       409.1.0        2023/05/31  11:00:01.695  
 210.2        12  IN     01 00 00 00  00 00 00 03  00 00 00 00               ............      995us       410.1.0        2023/05/31  11:00:01.696  
 210.2        12  IN     01 00 00 00  01 00 00 03  00 00 00 00               ............      185ms       411.1.0        2023/05/31  11:00:01.881  
